{
  "id": "mat-4-3",
  "typ": "quellentext",
  "titel": "Vernichtungsbefehl — was „Schutzgebiet“ wirklich bedeutete",
  "inhalt": "<p><em>Nach der Niederlage der Herero im August 1904 verfolgte die deutsche Kolonialarmee die Ueberlebenden in die Omaheke-Wueste. Dort unterschrieb General Lothar von Trotha im Oktober 1904 einen Befehl. Historiker nennen ihn heute den \"Vernichtungsbefehl\".</em></p><blockquote>\"Die Herero sind nicht mehr Deutsche Untertanen. [...] Innerhalb der Deutschen Grenze wird jeder Herero mit oder ohne Gewehr, mit oder ohne Vieh erschossen, ich nehme keine Weiber und keine Kinder mehr auf, treibe sie zu ihrem Volke zurueck oder lasse auch auf sie schiessen.\"</blockquote><p><em>Trotha ergaenzte: \"Ich glaube, dass die Nation als solche vernichtet werden muss.\" Der Begriff \"Schutzgebiet\" bezeichnete offiziell die Kolonie. In Wahrheit stand er fuer Landraub, Unterwerfung und Gewalt. Die Wissenschaft bewertet dieses Vorgehen heute als den ersten Voelkermord des 20. Jahrhunderts. Von rund 80.000 Herero ueberlebten nur 15.000 bis 20.000. Quelle: Trotha, Lothar von: Proklamation vom 2. Oktober 1904, zitiert nach Wikipedia DE, \"Voelkermord an den Herero und Nama\" (Einleitung).</em></p>",
  "quelle": "Trotha, Lothar von: Proklamation an das Volk der Herero, 2. Oktober 1904. Zitiert nach: Wikipedia DE, \"Voelkermord an den Herero und Nama\", Einleitung (Artefakt-Ref pq-4-1).",
  "position": 3,
  "didaktische_funktion": "erarbeitung",
  "voraussetzung": [
    "mat-4-2"
  ],
  "ueberleitung_von": "Der Wettlauf um Kolonien verschärfte die Rivalität zwischen den Großmächten. Doch was bedeutete er für die Menschen in den Kolonien?",
  "sequenz_kontext": {
    "vorher": {
      "id": "mat-4-2",
      "typ": "darstellungstext",
      "kerninhalt": "Weltpolitik, Marokkokrisen, wachsende Rivalität zwischen Großmächten"
    },
    "nachher": {
      "id": "mat-4-4",
      "typ": "bildquelle",
      "kerninhalt": "Foto gefangener Herero nach der Niederschlagung des Aufstands"
    }
  },
  "_meta": {
    "wortanzahl": 158,
    "quellentyp": "amtlich",
    "aufbereitung": "gemischt",
    "rekonstruktions_begruendung": "Primaerquellen-Vorrang (MQ2 v3.10.4): Der Original-Wortlaut von Trothas Proklamation ist historisch gesichert und wird wortgetreu als Zitat uebernommen. Aus didaktischen Gruenden (R7, Ueberwaeltigungsverbot) ist der Befehl gekuerzt ([...]) und durch R7-konforme Einleitung/Kontextualisierung gerahmt. Deshalb Einstufung als 'gemischt' (echter Wortlaut + didaktische Aufbereitung).",
    "artefakt_ref": [
      "pq-4-1"
    ],
    "tafelbild_knoten_abgedeckt": [
      "k4-3"
    ],
    "quellenkritische_impulse": [
      "Wer spricht in dieser Quelle? Wen schliesst der Text ein, wen schliesst er aus?",
      "Warum nennt die deutsche Kolonialverwaltung die Kolonie 'Schutzgebiet'? Was verschleiert dieser Begriff?",
      "Welche Absicht zeigt Trothas Satz 'Ich glaube, dass die Nation als solche vernichtet werden muss.'?",
      "Wie unterscheidet sich die Perspektive des Befehls von der Perspektive der Herero und Nama?"
    ],
    "perspektive": "multiperspektivisch: P1 Deutsche Reichsfuehrung (Trotha, Kolonialverwaltung) kontrastiert mit P3 Kolonisierte Herero und Nama als Opfer und Traeger des Widerstands",
    "erarbeitbarkeits_check": "DIRECT: Der Quellentext fuehrt direkt zu k4-3 (Koloniale Ausbeutung und Gewalt). SuS erarbeiten am Wortlaut des Befehls die Absicht der Kolonialmacht und die Dimension der Gewalt. Voraussetzung k4-1/k4-2/k4-4 (Weltpolitik, Marokkokrisen, Rivalitaet) ist aus mat-4-2 eingefuehrt.",
    "trigger_flags": [
      "Kolonisierung",
      "Gewalt",
      "Macht-Asymmetrie",
      "Unterdrueckung",
      "Ueberwaeltigungsverbot_sensibel"
    ]
  }
}
