{
  "id": "mat-1-2",
  "typ": "bildquelle",
  "titel": "Das Hambacher Fest — Zug zum Schloss",
  "inhalt": "../../assets/img/deutscher-nationalismus-kolonialismus/img-1-1.jpg",
  "bildunterschrift": "Kolorierte Federlithographie des Hambacher Festes, 27. Mai 1832. Zwischen 20.000 und 30.000 Menschen zogen mit schwarz-rot-goldenen Fahnen zum Hambacher Schloss in der Rheinpfalz — ein Zeichen der wachsenden Nationalbewegung. Es war eine der größten politischen Versammlungen in Deutschland. Die Teilnehmer forderten nationale Einheit, Freiheit und das Recht, sich selbst zu regieren. Die Original-Fahne mit der Aufschrift „Deutschlands Wiedergeburt“ wird heute im Hambacher Schloss aufbewahrt.",
  "lizenz": "Public Domain (img-1-1); GFDL (img-1-4)",
  "quelle": "Kolorierte Federlithographie, 1832. Darstellung des Festzugs zum Hambacher Schloss am 27. Mai 1832. Wikimedia Commons: Hambacher_Fest_1832.jpg. Ergänzend: Original-Fahne des Hambacher Festes, Wikimedia Commons: Hambach_Fest_4_Fahne.JPG.",
  "position": 2,
  "didaktische_funktion": "erarbeitung",
  "voraussetzung": [
    "mat-1-1"
  ],
  "ueberleitung_von": "Fünfzehn Jahre nach dem Wartburgfest wurde aus dem Wunsch einzelner Studenten eine Massenbewegung.",
  "sequenz_kontext": {
    "vorher": {
      "id": "mat-1-1",
      "typ": "tagebuch",
      "kerninhalt": "Wartburgfest-Erlebnis eines Studenten"
    },
    "nachher": {
      "id": "mat-1-3",
      "typ": "quellentext",
      "kerninhalt": "Forderungen der Festredner"
    }
  },
  "_meta": {
    "wortanzahl": 66,
    "perspektive": "P1 Bürger/Nationalbewegung",
    "artefakt_ref": [
      "pb-1-1",
      "pb-1-4"
    ],
    "tafelbild_knoten_abgedeckt": [
      "k1-2",
      "k1-3"
    ],
    "trigger_flags": [],
    "erarbeitbarkeits_check": "PASS — SuS erkennen am Bild die Größe der Versammlung (k1-2) und die Farben Schwarz-Rot-Gold als Symbol der Nationalbewegung (k1-3). Bildunterschrift benennt den Fachbegriff."
  }
}
