{
  "id": "mat-4-3",
  "typ": "quellentext",
  "titel": "Vernichtungsbefehl — was „Schutzgebiet“ wirklich bedeutete",
  "inhalt": "<p><em>Im Oktober 1904 erliess Generalleutnant Lothar von Trotha in Deutsch-Suedwestafrika einen Befehl gegen die aufstaendischen Herero. Der Wortlaut zeigt, was das Wort \"Schutzgebiet\" wirklich bedeutete.</em></p><blockquote><p>„Die Herero sind nicht mehr Deutsche Untertanen. [...] Innerhalb der Deutschen Grenze wird jeder Herero mit oder ohne Gewehr, mit oder ohne Vieh erschossen, ich nehme keine Weiber und keine Kinder mehr auf, treibe sie zu ihrem Volke zurueck oder lasse auch auf sie schiessen.\"</p><cite>— Lothar von Trotha, Vernichtungsbefehl vom 2. Oktober 1904</cite></blockquote><p><em>Trotha droht also die Erschiessung aller Herero an — Maenner, Frauen und Kinder. Zusaetzlich erklaerte er, die Nation muesse als solche vernichtet werden. Heute gilt sein Vorgehen als erster Voelkermord — als geplante Ausloeschung einer ganzen Volksgruppe — des 20. Jahrhunderts.</em></p>",
  "quelle": "Wikipedia DE: Voelkermord an den Herero und Nama, Einleitung (Artefakt pq-4-1). Befehl Lothar von Trothas vom 2. Oktober 1904.",
  "position": 3,
  "didaktische_funktion": "erarbeitung",
  "voraussetzung": [
    "mat-4-2"
  ],
  "ueberleitung_von": "Der Wettlauf um Kolonien verschärfte die Rivalität zwischen den Großmächten. Doch was bedeutete er für die Menschen in den Kolonien?",
  "sequenz_kontext": {
    "vorher": {
      "id": "mat-4-2",
      "typ": "darstellungstext",
      "kerninhalt": "Weltpolitik, Marokkokrisen, wachsende Rivalität zwischen Großmächten"
    },
    "nachher": {
      "id": "mat-4-4",
      "typ": "bildquelle",
      "kerninhalt": "Foto gefangener Herero nach der Niederschlagung des Aufstands"
    }
  },
  "_meta": {
    "wortanzahl": 109,
    "quellentyp": "amtlich",
    "aufbereitung": "gemischt",
    "rekonstruktions_begruendung": "Kern-Wortlaut aus pq-4-1 wortgetreu uebernommen (Primaerquellen-Ausnahme R7). Einleitungs- und Erlaeuterungs-Prosa R7-konform umformuliert. Auslassung mit [...] markiert. Trothas zweiter Satz zur Vernichtung der Nation sinngemaess paraphrasiert, um Wortanzahl-Cap zu halten.",
    "artefakt_ref": [
      "pq-4-1"
    ],
    "tafelbild_knoten_abgedeckt": [
      "k4-3"
    ],
    "perspektive": "multiperspektivisch: P1 Deutsche Reichsfuehrung (Trotha) kontrastiert implizit mit P3 Kolonisierte Herero als Adressaten/Opfer",
    "quellenkritische_impulse": [
      "Wer spricht hier mit welcher Autoritaet und an wen richtet sich der Befehl?",
      "Welche sprachlichen Mittel verschleiern oder rechtfertigen die angeordnete Gewalt?",
      "Was sagt der Begriff \"Schutzgebiet\" im Vergleich zu diesem Befehl aus?"
    ],
    "trigger_flags": [
      "Kolonisierung",
      "Gewalt",
      "Macht-Asymmetrie",
      "Unterdrueckung"
    ]
  }
}
